{
  "jurisdiction": { "country": "NP", "municipality": "Kathmandu Metropolitan City", "ward": "10" },
  "site": {
    "shape": "rectangle",
    "rectangle": { "width": { "value": 11.25, "unit": "m" }, "depth": { "value": 11.25, "unit": "m" } },
    "sideLengths": [{ "value": 11.25, "unit": "m" }, { "value": 11.25, "unit": "m" }, { "value": 11.25, "unit": "m" }, { "value": 11.25, "unit": "m" }],
    "declaredArea": { "value": 4, "unit": "aana" },
    "north": { "bearingDegrees": 0, "evidence": "survey drawing" },
    "frontageEdges": [{ "edgeIndex": 0, "roadWidth": { "value": 4, "unit": "m" } }]
  },
  "buildingProgram": {
    "storeys": 2.5,
    "households": 1, "bedrooms": 3, "bathrooms": 2, "kitchens": 1, "livingRooms": 1, "puja": true,
    "rental": { "intended": false, "floorCount": 0 },
    "ownerProgram": { "bedrooms": 3, "bathrooms": 2, "attachedBathrooms": 1, "kitchens": 1, "livingRooms": 1, "specialRooms": ["puja"] },
    "levels": [
      { "id": "ground", "kind": "full", "elevation": { "value": 0, "unit": "m" }, "use": "family", "occupancy": "owner", "bedrooms": 0, "bathrooms": 1, "kitchens": 1, "livingRooms": 1, "attachedBathrooms": 0, "specialRooms": ["puja"] },
      { "id": "first", "kind": "full", "elevation": { "value": 3, "unit": "m" }, "use": "bedrooms", "occupancy": "owner", "bedrooms": 3, "bathrooms": 1, "kitchens": 0, "livingRooms": 0, "attachedBathrooms": 1, "specialRooms": [] },
      { "id": "partial-second", "kind": "partial", "elevation": { "value": 6, "unit": "m" }, "targetArea": { "value": 50, "unit": "sq_m" }, "use": "laundry and terrace access", "occupancy": "owner", "bedrooms": 0, "bathrooms": 0, "kitchens": 0, "livingRooms": 0, "attachedBathrooms": 0, "specialRooms": [] }
    ],
    "parking": { "bikes": 2, "cars": 0 }, "stair": { "type": "halfTurnLanding" }
  },
  "vastuProfile": "Jain-led"
}
